{
  "$schema": "../schemas/application-metadata.schema.json",
  "workspacePurpose": "application",
  "runtimeTargets": [
    {
      "engine": "Node.js",
      "version": "20+"
    }
  ],
  "source": "manual",
  "generatedAt": "2026-05-18T21:54:36.596Z",
  "frameworks": [
    "VS Code Extension API"
  ],
  "languageHints": [
    "typescript",
    "javascript"
  ],
  "notes": "VS Code extension profile using Node.js runtime and TypeScript/JavaScript tooling."
}
